<?xml version="1.0" encoding="ISO-8859-1" ?>
<!--This is the document type defintion file for hep.aida IStyleStore xml files-->



<!ELEMENT aidaStyleStore (aidaStyleStoreEntry*) > 
<!ATTLIST aidaStyleStore 
    storeName    CDATA #REQUIRED 
    storeType    CDATA #REQUIRED
    isReadOnly   CDATA #REQUIRED
> 

<!ELEMENT aidaStyleStoreEntry (aidaStyleRule, aidaPlotterStyle) > 
<!ATTLIST aidaStyleStoreEntry 
    entryName    CDATA #REQUIRED 
    entryType    CDATA #IMPLIED
> 

<!ELEMENT aidaStyleRule (EMPTY) > 
<!ATTLIST aidaStyleRule 
    ruleValue    CDATA #REQUIRED 
    ruleType     CDATA #IMPLIED
> 

<!ELEMENT aidaPlotterStyle (  ( aidaStyle | aidaStyleAttribute)+ ) > 
 
<!ELEMENT aidaStyle (  ( aidaStyle | aidaStyleAttribute)+ ) > 
<!ATTLIST aidaStyle
    type CDATA #REQUIRED
>
 
<!ELEMENT aidaStyleAttribute (EMPTY) >
<!ATTLIST aidaStyleAttribute 
    attributeName     CDATA #REQUIRED 
    attributeValue    CDATA #REQUIRED 
>
 
 
